{
  "schema_version": "ctxora.artifacts.v1",
  "canonical_root": "src/harness_context/artifacts/canonical",
  "projections": {
    "agents": "agents",
    "commands": "commands",
    "skills": "skills"
  },
  "artifact_count": 19,
  "artifacts": [
    {
      "id": "ctxora-context-engineer",
      "kind": "agents",
      "source": "agents/ctxora-context-engineer.md",
      "capability": "agents",
      "targets": [
        "codex",
        "claude-code"
      ],
      "dependencies": [],
      "content_hash": "76a88e90f48d3881aa986bfac7420eeb2210705973b6cd9ee3e6b39a53b8df57",
      "files": [
        {
          "path": "ctxora-context-engineer.md",
          "sha256": "597f39fe1e08af32fce0507799922ae82caf68b340bed710076484f77242fdc9"
        }
      ],
      "provenance": {
        "origin": "ctxora",
        "source": "ctxora-engine",
        "license": "MIT"
      }
    },
    {
      "id": "ctxora-maintainer",
      "kind": "agents",
      "source": "agents/ctxora-maintainer.md",
      "capability": "agents",
      "targets": [
        "codex",
        "claude-code"
      ],
      "dependencies": [],
      "content_hash": "44959cae1d1de56afc4920aabdd8ab32057a9ae8e50496eaa4528c14a5fe1d1f",
      "files": [
        {
          "path": "ctxora-maintainer.md",
          "sha256": "8c4077abda0379f8e535c98c908d4361227abc3b632db6c884b5169a9bd16013"
        }
      ],
      "provenance": {
        "origin": "ctxora",
        "source": "ctxora-engine",
        "license": "MIT"
      }
    },
    {
      "id": "ctxora-planner",
      "kind": "agents",
      "source": "agents/ctxora-planner.md",
      "capability": "agents",
      "targets": [
        "codex",
        "claude-code"
      ],
      "dependencies": [],
      "content_hash": "afc0af3cbe7b36830848971af957d4893746df6ec7673755ad7ae27fece7eb8e",
      "files": [
        {
          "path": "ctxora-planner.md",
          "sha256": "a45ea5543c2bb0b8e00d6d234453ebca1c3c5cfc5907d0dc3a2c1029f0c49449"
        }
      ],
      "provenance": {
        "origin": "ctxora",
        "source": "ctxora-engine",
        "license": "MIT"
      }
    },
    {
      "id": "ctxora-researcher",
      "kind": "agents",
      "source": "agents/ctxora-researcher.md",
      "capability": "agents",
      "targets": [
        "codex",
        "claude-code"
      ],
      "dependencies": [],
      "content_hash": "d3ec2d65d42640107ce6025ddeae3b89759891d737d417c7d65f523bfa2832ab",
      "files": [
        {
          "path": "ctxora-researcher.md",
          "sha256": "e845d34f0c03ff2369267e197ca18c0bab9154a8ec1e62d6232c9056281a130b"
        }
      ],
      "provenance": {
        "origin": "ctxora",
        "source": "ctxora-engine",
        "license": "MIT"
      }
    },
    {
      "id": "ctxora-reviewer",
      "kind": "agents",
      "source": "agents/ctxora-reviewer.md",
      "capability": "agents",
      "targets": [
        "codex",
        "claude-code"
      ],
      "dependencies": [],
      "content_hash": "773b883da8439b4750f1443082a13fb0a6b7cc194560637427a4e9c9b58326e9",
      "files": [
        {
          "path": "ctxora-reviewer.md",
          "sha256": "ba28715dbb582486a4ac6200928ff48156b977a956d15d4c4df4ad9fc2d8472c"
        }
      ],
      "provenance": {
        "origin": "ctxora",
        "source": "ctxora-engine",
        "license": "MIT"
      }
    },
    {
      "id": "context",
      "kind": "commands",
      "source": "commands/context.md",
      "capability": "commands",
      "targets": [
        "claude-code"
      ],
      "dependencies": [],
      "content_hash": "6093d570043904783ea275e80cd730365255f188a3ef5c145bdd65deab2d131f",
      "files": [
        {
          "path": "context.md",
          "sha256": "102fff5fda5962bcc301aa5c6c4eb7ad3b6186917d2ca4e8378181804f327fa1"
        }
      ],
      "provenance": {
        "origin": "ctxora",
        "source": "ctxora-engine",
        "license": "MIT"
      }
    },
    {
      "id": "guide",
      "kind": "commands",
      "source": "commands/guide.md",
      "capability": "commands",
      "targets": [
        "claude-code"
      ],
      "dependencies": [],
      "content_hash": "06c83df51e29467bd09ebfef8f77397371761b6c6acc737888395b7510e99816",
      "files": [
        {
          "path": "guide.md",
          "sha256": "253c84711726573ceecdb8e653f2d2ebb1a050aa7a68551cf8f7e36e2282fb72"
        }
      ],
      "provenance": {
        "origin": "ctxora",
        "source": "ctxora-engine",
        "license": "MIT"
      }
    },
    {
      "id": "handoff",
      "kind": "commands",
      "source": "commands/handoff.md",
      "capability": "commands",
      "targets": [
        "claude-code"
      ],
      "dependencies": [],
      "content_hash": "cda338773c269d9ff9c478edff05c9b855e7bd024231e1454e236c9ead8ff5d6",
      "files": [
        {
          "path": "handoff.md",
          "sha256": "4137c75631703f51b7d4023ffb5c5d95827b1d157bf231cba32c11c9837fd9a1"
        }
      ],
      "provenance": {
        "origin": "ctxora",
        "source": "ctxora-engine",
        "license": "MIT"
      }
    },
    {
      "id": "health",
      "kind": "commands",
      "source": "commands/health.md",
      "capability": "commands",
      "targets": [
        "claude-code"
      ],
      "dependencies": [],
      "content_hash": "03fe5c1c714abe7c27d7cb3c548de7c44279aa8dd710d01292221f385b42896f",
      "files": [
        {
          "path": "health.md",
          "sha256": "976c8708c4cc5c038b03c7b55f06995219a3644a46632524eca7a8f69266635b"
        }
      ],
      "provenance": {
        "origin": "ctxora",
        "source": "ctxora-engine",
        "license": "MIT"
      }
    },
    {
      "id": "learn",
      "kind": "commands",
      "source": "commands/learn.md",
      "capability": "commands",
      "targets": [
        "claude-code"
      ],
      "dependencies": [],
      "content_hash": "b0f6a5078372adb936457cd93728b2da87ba716da1f8570cc6d20491666b433e",
      "files": [
        {
          "path": "learn.md",
          "sha256": "aae90f8595837a9fbf0ef8d11b4ae35b1cb218e6fdfc191f02fadd264809908f"
        }
      ],
      "provenance": {
        "origin": "ctxora",
        "source": "ctxora-engine",
        "license": "MIT"
      }
    },
    {
      "id": "plan",
      "kind": "commands",
      "source": "commands/plan.md",
      "capability": "commands",
      "targets": [
        "claude-code"
      ],
      "dependencies": [],
      "content_hash": "a2edf8cb0a208b63e9c8aca9d4bb39eb37756d3d7fb43618f90d922ed27e9b94",
      "files": [
        {
          "path": "plan.md",
          "sha256": "3b721ca4048fd4377627185f99f3559372ce471c27f2cf22f889afb5c1114e9c"
        }
      ],
      "provenance": {
        "origin": "ctxora",
        "source": "ctxora-engine",
        "license": "MIT"
      }
    },
    {
      "id": "review",
      "kind": "commands",
      "source": "commands/review.md",
      "capability": "commands",
      "targets": [
        "claude-code"
      ],
      "dependencies": [],
      "content_hash": "20a323524a02bec22701af551b8409e441295843913e6a2ffc37fc2d4d2ca8b0",
      "files": [
        {
          "path": "review.md",
          "sha256": "9034503d995d97885cafcb57de89268f15858006528ab51641b46a3875b6bf85"
        }
      ],
      "provenance": {
        "origin": "ctxora",
        "source": "ctxora-engine",
        "license": "MIT"
      }
    },
    {
      "id": "route",
      "kind": "commands",
      "source": "commands/route.md",
      "capability": "commands",
      "targets": [
        "claude-code"
      ],
      "dependencies": [],
      "content_hash": "62b091781931e92520d3bd6cc3bbd88565c3508fbc1182085a2e7a20dada6c90",
      "files": [
        {
          "path": "route.md",
          "sha256": "82e4b8b8a6956c6365ac7b9db5364f428d1609783a2e382ffa8fa335292eab07"
        }
      ],
      "provenance": {
        "origin": "ctxora",
        "source": "ctxora-engine",
        "license": "MIT"
      }
    },
    {
      "id": "ctxora-context-health",
      "kind": "skills",
      "source": "skills/ctxora-context-health",
      "capability": "skills",
      "targets": [
        "codex",
        "claude-code",
        "cursor",
        "gemini",
        "opencode"
      ],
      "dependencies": [],
      "content_hash": "5a2fe30e6dc2a53cd4b9a8cbcaeeeb91e453d06b1fed1909d587c30032b31117",
      "files": [
        {
          "path": "SKILL.md",
          "sha256": "a408edbaf91ec58494db72f49e3d74a2f6f80be87bba4d23878b6e6ee5d01a01"
        }
      ],
      "provenance": {
        "origin": "ctxora",
        "source": "ctxora-engine",
        "license": "MIT"
      }
    },
    {
      "id": "ctxora-continuous-learning",
      "kind": "skills",
      "source": "skills/ctxora-continuous-learning",
      "capability": "skills",
      "targets": [
        "codex",
        "claude-code",
        "cursor",
        "gemini",
        "opencode"
      ],
      "dependencies": [],
      "content_hash": "ac9978c82c88dac5b94184d02e03697cd0f4c01ca9bcc92018c5e4c1082742dc",
      "files": [
        {
          "path": "SKILL.md",
          "sha256": "7d8beb5f7bf6812b0458e141a51207b0c3958ce492b87c3a321e1d24f2041550"
        }
      ],
      "provenance": {
        "origin": "ctxora",
        "source": "ctxora-engine",
        "license": "MIT"
      }
    },
    {
      "id": "ctxora-navigation",
      "kind": "skills",
      "source": "skills/ctxora-navigation",
      "capability": "skills",
      "targets": [
        "codex",
        "claude-code",
        "cursor",
        "gemini",
        "opencode"
      ],
      "dependencies": [],
      "content_hash": "bfa8f6f62bcc31a02ed24ee4c19d27df5019b2b7575525dc94abf7756296e397",
      "files": [
        {
          "path": "SKILL.md",
          "sha256": "8a65219bfc8bd49b22a745c8d51d5417ac4081df3028f6ce6b905e67bcd0ee18"
        }
      ],
      "provenance": {
        "origin": "ctxora",
        "source": "ctxora-engine",
        "license": "MIT"
      }